{
  "som_version": "0.3.2",
  "message_id": "019536a2-7c3f-7d8e-a1b2-000000000005",
  "correlation_id": "019536a0-5555-7000-8000-000000000005",
  "message_type": "story.context",
  "timestamp": "2026-05-06T18:02:14.000000Z",
  "topic": "som.story.context",
  "payload": {
    "story_id": "manhattan-explosion-2026-0506",
    "slug": "MANHATTAN-MIDTOWN-EXPLOSION",
    "headline": "Explosion Reported at Midtown Manhattan Office Tower",
    "story_type": "ACTIVE",
    "lifecycle": {
      "phase": "BREAKING",
      "phase_entered_at": "2026-05-06T18:01:30Z",
      "previous_phase": "DEVELOPING",
      "phase_owner": {
        "user_id": "editor-mgarcia",
        "display_name": "Maria Garcia",
        "role": "output_editor"
      }
    },
    "priority": {
      "level": "URGENT",
      "reason": "Active scene, breaking on wire",
      "escalated_by": "ncs-nbcu-nyc-01",
      "escalated_at": "2026-05-06T18:02:00Z"
    },
    "premise": {
      "expected_outcome": "developing_facts",
      "confidence": "LOW",
      "premise_changed": false
    },
    "story_meaning": {
      "who": "Unknown individuals at a Midtown Manhattan office tower, FDNY first responders, and the NBC News breaking-news desk.",
      "what": "An explosion was reported at a Midtown Manhattan office tower, with facts still developing and scene response active.",
      "when": "Story published 18:02 ET on 6 May 2026; BREAKING phase entered at 18:01:30Z.",
      "where": "Midtown Manhattan, New York City; specific tower identity pending official confirmation.",
      "why": "Active scene with unverified casualty and cause information; story entered the bus before NBCU compliance flags or assets were attached.",
      "how": "Initial reporting via AP wire and FDNY dispatch radio; downstream skills are expected to flag the absence of compliance metadata under the BREAKING phase.",
      "summary": "An explosion has been reported at a Midtown Manhattan office tower, with facts still developing. The story entered the bus with no compliance flags and no prepared assets, intentionally exercising the editorial-standards skill's BREAKING-phase compliance check. Coverage is rolling across MSNBC and NBCNews.com while details from FDNY and AP are confirmed.",
      "confidence": 0.7,
      "provenance_refs": [
        "src-ap-20260506-1801",
        "src-fdny-radio-01"
      ]
    },
    "assets": [],
    "ai_enrichments": [],
    "skills_config": {
      "skills_spec_version": "2.0.0",
      "skill_executor_id": "executor-nbcu-nyc-01",
      "scope_context": "MSNBC Rolling Coverage",
      "active_skills": [
        {
          "skill_id": "nbcu/editorial-standards",
          "skill_version": "0.1.0",
          "skill_type": "NEWSROOM",
          "disclosure_level": "L2",
          "migration_policy": "GATED",
          "skill_priority": "CRITICAL"
        }
      ],
      "newsroom": "NBCU"
    },
    "updated_at": "2026-05-06T18:02:14Z",
    "sequence_number": 1,
    "content_refs": [
      {
        "mime_type": "text/plain",
        "placement": "sources",
        "provider": "NBCU",
        "source_id": "src-fdny-pio",
        "uri": "http://localhost:5050/api/content/manhattan-explosion-2026-0506"
      }
    ],
    "editorial_source": [
      {
        "source_id": "src-ap-20260506-1801",
        "source_type": "WIRE",
        "provider": "Associated Press",
        "credibility": "VERIFIED",
        "received_at": "2026-05-06T18:01:45Z",
        "content_hash": "sha256:9f8e7d6c5b4a..."
      },
      {
        "source_id": "src-fdny-radio-01",
        "source_type": "SCANNER",
        "provider": "FDNY Dispatch",
        "credibility": "TRUSTED",
        "received_at": "2026-05-06T18:01:50Z"
      }
    ],
    "newsroom_id": "nbcu-news"
  },
  "originating_system": {
    "system_id": "ncs-nbcu-nyc-01",
    "system_type": "ncs",
    "system_name": "iNEWS NYC",
    "vendor": "Avid",
    "version": "7.0.1"
  }
}