{
  "som_version": "0.3.2",
  "message_id": "019536a2-7c3f-7d8e-a1b2-000000000003",
  "correlation_id": "019536a0-3333-7000-8000-000000000003",
  "message_type": "story.context",
  "timestamp": "2026-05-10T16:20:00.000000Z",
  "topic": "som.story.context",
  "payload": {
    "story_id": "lapd-counterfeit-2026-0510",
    "slug": "LAPD-COUNTERFEIT-SNEAKER-BUST",
    "headline": "Cops Bust Ring of Kids Selling Counterfeit Sneakers in Downtown LA",
    "story_type": "ACTIVE",
    "lifecycle": {
      "phase": "DEVELOPING",
      "phase_entered_at": "2026-05-10T15:45:00Z",
      "phase_owner": {
        "user_id": "editor-rjohnson",
        "display_name": "Rachel Johnson",
        "role": "assignment_editor"
      }
    },
    "priority": {
      "level": "ROUTINE",
      "reason": "Local crime story"
    },
    "premise": {
      "expected_outcome": "arrests_charges_filed",
      "confidence": "HIGH",
      "premise_changed": false
    },
    "story_meaning": {
      "who": "LAPD officers and unnamed suspects, including individuals under 18, with the KNBC Los Angeles desk handling coverage.",
      "what": "LAPD arrested multiple individuals in a counterfeit-sneaker operation in downtown Los Angeles, with some suspects identified as minors.",
      "when": "Story published 16:20 PT on 10 May 2026 with the DEVELOPING phase entered at 15:45 PT.",
      "where": "Downtown Los Angeles Fashion District; jurisdiction US-CA with CA Welfare and Institutions Code 827 in effect.",
      "why": "Minors involvement requires identity protection, and suspects not yet arraigned demand 'alleged' and 'accused' language under legal-review compliance.",
      "how": "Reported via LAPD Public Information Office and KNBC field crew; story routed through the editorial-standards skill to catch informal headline language and protect minor identities.",
      "summary": "LAPD arrested multiple individuals \u2014 including minors \u2014 in a counterfeit-sneaker operation in the downtown Los Angeles Fashion District. The story carries HIGH compliance under CA Welfare and Institutions Code 827 (no minor identification) and MEDIUM legal-review compliance because suspects have not yet been arraigned, requiring 'alleged' and 'accused' framing throughout.",
      "confidence": 0.92,
      "provenance_refs": [
        "src-lapd-pio",
        "src-knbc-crew-01"
      ]
    },
    "compliance": [
      {
        "flag_id": "cf-minor-001",
        "type": "MINOR_INVOLVED",
        "severity": "HIGH",
        "detail": "Suspects include individuals under 18. Do not identify minors.",
        "jurisdiction": "US-CA",
        "regulation_ref": "CA Welfare & Institutions Code 827",
        "raised_by": "compliance-engine-01",
        "raised_at": "2026-05-10T16:00:00Z",
        "status": "ACTIVE"
      },
      {
        "flag_id": "cf-legal-001",
        "type": "LEGAL_REVIEW",
        "severity": "MEDIUM",
        "detail": "Suspects not yet arraigned. Use 'alleged' and 'accused' language.",
        "jurisdiction": "US",
        "raised_by": "legal-desk",
        "raised_at": "2026-05-10T16:05:00Z",
        "status": "ACTIVE"
      }
    ],
    "editorial_gates": [],
    "assets": [
      {
        "asset_id": "pkg-counterfeit-bust-v1",
        "asset_type": "x-package",
        "status": "IN_PRODUCTION",
        "delivery_spec": {
          "format": "mxf",
          "resolution": "1920x1080",
          "frame_rate": 29.97
        },
        "evidential_position": "TERTIARY"
      },
      {
        "asset_id": "lt-lapd-arrest",
        "asset_type": "LOWER_THIRD",
        "status": "READY",
        "evidential_position": "TERTIARY"
      },
      {
        "asset_id": "gfx-suspect-count",
        "asset_type": "FULL_FRAME",
        "status": "READY",
        "evidential_position": "TERTIARY"
      },
      {
        "asset_id": "ai-summary-003",
        "asset_type": "SUMMARY",
        "status": "IN_PRODUCTION",
        "provenance": {
          "author": "MODEL",
          "model": "claude-sonnet-4",
          "model_version": "20250514",
          "confidence": 0.9,
          "generated_at": "2026-05-10T16:15:00Z",
          "input_sources": [
            "src-lapd-pio"
          ],
          "prompt_hash": "sha256:d4e5f6a7...",
          "review": {
            "state": "PENDING"
          }
        }
      }
    ],
    "skills_config": {
      "skills_spec_version": "2.0.0",
      "skill_executor_id": "executor-nbcu-la-01",
      "scope_context": "KNBC Local News",
      "active_skills": [
        {
          "skill_id": "nbcu/editorial-standards",
          "skill_version": "0.1.0",
          "skill_type": "NEWSROOM",
          "disclosure_level": "L2",
          "migration_policy": "GATED",
          "skill_priority": "CRITICAL"
        }
      ],
      "newsroom": "NBCU"
    },
    "updated_at": "2026-05-10T16:20:00Z",
    "sequence_number": 12,
    "content_refs": [
      {
        "mime_type": "text/plain",
        "placement": "sources",
        "provider": "NBCU",
        "source_id": "src-lapd-pio",
        "uri": "http://localhost:5050/api/content/lapd-counterfeit-2026-0510"
      }
    ],
    "editorial_source": [
      {
        "source_id": "src-lapd-pio",
        "source_type": "OFFICIAL",
        "provider": "LAPD Public Information Office",
        "credibility": "ENDORSED",
        "received_at": "2026-05-10T15:30:00Z"
      },
      {
        "source_id": "src-knbc-crew-01",
        "source_type": "FIELD_CREW",
        "provider": "KNBC Field Unit 7",
        "credibility": "TRUSTED",
        "received_at": "2026-05-10T16:10:00Z"
      }
    ],
    "newsroom_id": "nbcu-news"
  },
  "originating_system": {
    "system_id": "ncs-nbcu-la-01",
    "system_type": "ncs",
    "system_name": "iNEWS Los Angeles",
    "vendor": "Avid",
    "version": "7.0.1"
  }
}
