{
  "som_version": "0.3.2",
  "message_id": "019536a2-7c3f-7d8e-a1b2-000000000001",
  "correlation_id": "019536a0-1111-7000-8000-000000000001",
  "message_type": "story.context",
  "timestamp": "2026-04-01T14:45:00.123456Z",
  "topic": "som.story.context",
  "payload": {
    "story_id": "sentencing-2026-0401",
    "slug": "JONES-SENTENCING-FED-CT",
    "headline": "Jones Sentencing \u2014 Federal Court Verdict Overturns Expectations",
    "story_type": "ACTIVE",
    "lifecycle": {
      "phase": "BREAKING",
      "phase_entered_at": "2026-04-01T14:44:30Z",
      "previous_phase": "READY_TO_AIR",
      "phase_owner": {
        "user_id": "editor-mgarcia",
        "display_name": "Maria Garcia",
        "role": "output_editor"
      }
    },
    "priority": {
      "level": "URGENT",
      "reason": "Verdict contradicts premise \u2014 assets invalid",
      "escalated_by": "ncs-nbcu-nyc-01",
      "escalated_at": "2026-04-01T14:45:00Z"
    },
    "premise": {
      "expected_outcome": "guilty_verdict_custodial",
      "confidence": "LOW",
      "premise_changed": true,
      "previous_outcome": "guilty_verdict_custodial",
      "actual_outcome": "not_guilty",
      "affected_assets": [
        "gfx-guilty-pack",
        "script-summary-v2",
        "lt-sentencing-001"
      ],
      "change_detected_at": "2026-04-01T14:44:55Z",
      "change_detected_by": "wire-ap-feed"
    },
    "story_meaning": {
      "who": "A US federal jury and defendant Jones, with NBC News national legal team covering the verdict.",
      "what": "Federal jury returned a not-guilty verdict in the Jones fraud trial, contradicting widely expected conviction and invalidating pre-prepared coverage assets.",
      "when": "Verdict delivered at 14:44 ET on 1 April 2026, during the BREAKING phase entered at 14:44:30Z.",
      "where": "United States federal court (Jones case docket); jurisdiction US per compliance flag cf-019536a2-0001.",
      "why": "Jury rejected the prosecution case on the merits; the outcome reversal triggers premise contradiction and an editorial legal-review gate on previously cleared sentencing assets.",
      "how": "Reported via AP wire and court pool camera; outcome cross-checked against the pre-prepared coverage plan now blocked by legal review (gate-legal-001).",
      "summary": "A US federal jury returned a not-guilty verdict in the Jones fraud trial, reversing the widely expected conviction. The reversal invalidated the network's pre-prepared graphics, scripts, and lower thirds, and triggered a CRITICAL premise-contradiction compliance flag plus an editorial legal-review gate blocking the existing assets ahead of NBC Nightly News.",
      "confidence": 0.65,
      "provenance_refs": [
        "src-ap-20260401-1444",
        "src-pool-camera-01"
      ]
    },
    "government_approval": {
      "status": "NOT_REQUIRED",
      "jurisdiction": "US"
    },
    "compliance": [
      {
        "flag_id": "cf-019536a2-0001",
        "type": "PREMISE_CONTRADICTION",
        "severity": "CRITICAL",
        "detail": "Not-guilty verdict contradicts pre-prepared assets",
        "jurisdiction": "US",
        "regulation_ref": "FCC Broadcast Standards 73.1217",
        "raised_by": "compliance-engine-01",
        "raised_at": "2026-04-01T14:45:00Z",
        "status": "ACTIVE"
      }
    ],
    "editorial_gates": [
      {
        "gate_id": "gate-legal-001",
        "gate_type": "LEGAL_REVIEW",
        "status": "PENDING",
        "required_by_skill": "us-court-reporting",
        "gate_rule_id": "usc-rule-defamation-001",
        "resolution_event_type": "skill.suggestion.resolved",
        "assigned_to": "legal-desk",
        "blocks": [
          "gfx-guilty-pack",
          "lt-sentencing-001"
        ]
      }
    ],
    "assets": [
      {
        "asset_id": "gfx-guilty-pack",
        "asset_type": "x-graphics_pack",
        "status": "INVALIDATED",
        "invalidated_by": "cf-019536a2-0001",
        "standards_clearance": {
          "status": "BLOCKED",
          "blocked_by": [
            "cf-019536a2-0001"
          ],
          "last_reviewed": "2026-04-01T14:45:00Z"
        },
        "evidential_position": "TERTIARY"
      },
      {
        "asset_id": "script-summary-v2",
        "asset_type": "SCRIPT",
        "status": "INVALIDATED",
        "invalidated_by": "cf-019536a2-0001",
        "evidential_position": "TERTIARY"
      },
      {
        "asset_id": "lt-sentencing-001",
        "asset_type": "LOWER_THIRD",
        "status": "INVALIDATED",
        "invalidated_by": "cf-019536a2-0001",
        "evidential_position": "TERTIARY"
      },
      {
        "asset_id": "a2",
        "asset_type": "VIDEO",
        "status": "READY",
        "evidential_position": "PRIMARY",
        "acquisition_state": "CAPTURED",
        "media_refs": [
          {
            "source": "tams://tams-gcp-store/9f2e7c1a",
            "label": "courthouse pool feed",
            "time_range": "[0:0_134:0)"
          }
        ],
        "voice_count": 1
      }
    ],
    "ai_enrichments": [
      {
        "enrichment_id": "ai-summary-001",
        "model": "claude-sonnet-4-20250514",
        "enrichment_type": "SUMMARY",
        "confidence": 0.92,
        "content": "Federal jury returns surprise not-guilty verdict in Jones fraud trial, contradicting widely expected conviction.",
        "provenance": {
          "input_sources": [
            "src-ap-20260401-1444"
          ],
          "prompt_hash": "sha256:f1e2d3c4...",
          "guardrails_applied": [
            "factual_grounding",
            "legal_sensitivity"
          ]
        },
        "human_reviewed": false,
        "generated_at": "2026-04-01T14:45:05Z"
      }
    ],
    "skills_config": {
      "skills_spec_version": "2.0.0",
      "skill_executor_id": "executor-nbcu-nyc-01",
      "scope_context": "NBC Nightly News",
      "active_skills": [
        {
          "skill_id": "nbcu/editorial-standards",
          "skill_version": "0.1.0",
          "skill_type": "NEWSROOM",
          "disclosure_level": "L2",
          "migration_policy": "GATED",
          "skill_priority": "CRITICAL"
        },
        {
          "skill_id": "nbcu/social-poster",
          "skill_version": "0.1.0",
          "skill_type": "NEWSROOM",
          "disclosure_level": "L2",
          "migration_policy": "GATED",
          "skill_priority": "NORMAL"
        }
      ],
      "newsroom": "NBCU"
    },
    "updated_at": "2026-04-01T14:45:12Z",
    "sequence_number": 47,
    "content_refs": [
      {
        "mime_type": "text/plain",
        "placement": "sources",
        "provider": "NBCU",
        "source_id": "src-ap-20260401-1444",
        "uri": "http://localhost:5050/api/content/sentencing-2026-0401"
      }
    ],
    "editorial_source": [
      {
        "source_id": "src-ap-20260401-1444",
        "source_type": "WIRE",
        "provider": "Associated Press",
        "credibility": "VERIFIED",
        "received_at": "2026-04-01T14:44:00Z",
        "content_hash": "sha256:a1b2c3d4e5f6..."
      },
      {
        "source_id": "src-pool-camera-01",
        "source_type": "POOL_FEED",
        "provider": "Court Pool Camera",
        "credibility": "TRUSTED",
        "received_at": "2026-04-01T14:44:30Z"
      }
    ],
    "newsroom_id": "nbcu-news"
  },
  "originating_system": {
    "system_id": "ncs-nbcu-nyc-01",
    "system_type": "ncs",
    "system_name": "iNEWS NYC",
    "vendor": "Avid",
    "version": "7.0.1"
  }
}