{
  "som_version": "0.3.2",
  "message_id": "019536a2-7c3f-7d8e-a1b2-000000000004",
  "correlation_id": "019536a0-4444-7000-8000-000000000004",
  "message_type": "story.context",
  "timestamp": "2026-05-12T11:00:00.000000Z",
  "topic": "som.story.context",
  "payload": {
    "story_id": "transit-expansion-2026-0512",
    "slug": "NYC-TRANSIT-EXPANSION-APPROVED",
    "headline": "City Council Approves $2.1 Billion Public Transit Expansion Plan",
    "story_type": "ACTIVE",
    "lifecycle": {
      "phase": "PUBLISHED",
      "phase_entered_at": "2026-05-12T10:30:00Z",
      "previous_phase": "READY_TO_AIR",
      "phase_owner": {
        "user_id": "editor-kwilliams",
        "display_name": "Karen Williams",
        "role": "output_editor"
      }
    },
    "priority": {
      "level": "ROUTINE",
      "reason": "Planned coverage \u2014 council vote expected"
    },
    "premise": {
      "expected_outcome": "council_approves_plan",
      "confidence": "HIGH",
      "premise_changed": false
    },
    "story_meaning": {
      "who": "The New York City Council, the Metropolitan Transportation Authority, and WNBC City Hall reporters.",
      "what": "New York City Council approved a $2.1 billion public-transit expansion plan, adding three new rail lines slated for operation by 2030.",
      "when": "Story published 11:00 ET on 12 May 2026; PUBLISHED phase entered at 10:30 ET following the council vote.",
      "where": "New York City, with policy impact across the five boroughs and the MTA service area; jurisdiction US.",
      "why": "A multi-billion-dollar capital programme materially changes the city's transit footprint; routine planned coverage anchored by an official vote tally.",
      "how": "Council vote tally confirmed via the City Council Clerk, complemented by an MTA press release and WNBC City Hall Bureau crew on site.",
      "summary": "The New York City Council voted 7-2 to approve a $2.1 billion expansion of the public-transit system, adding three new rail lines expected to be operational by 2030. The story is editorially verified with an official tally, and ran across WNBC News 4 New York at Noon, NBCNewYork.com, and NBC New York Social channels.",
      "confidence": 0.97,
      "provenance_refs": [
        "src-nyc-council-clerk",
        "src-mta-press",
        "src-wnbc-crew-03"
      ]
    },
    "compliance": [
      {
        "flag_id": "cf-verified-001",
        "type": "EDITORIAL_VERIFIED",
        "severity": "LOW",
        "detail": "Story verified by city desk. Official vote tally confirmed.",
        "jurisdiction": "US",
        "raised_by": "editor-kwilliams",
        "raised_at": "2026-05-12T10:15:00Z",
        "status": "RESOLVED"
      }
    ],
    "editorial_gates": [],
    "assets": [
      {
        "asset_id": "pkg-transit-vote-v1",
        "asset_type": "x-package",
        "status": "READY",
        "delivery_spec": {
          "format": "mxf",
          "resolution": "1920x1080",
          "frame_rate": 29.97
        },
        "standards_clearance": {
          "status": "CLEARED",
          "last_reviewed": "2026-05-12T10:20:00Z"
        },
        "evidential_position": "TERTIARY"
      },
      {
        "asset_id": "gfx-transit-map-v1",
        "asset_type": "FULL_FRAME",
        "status": "READY",
        "delivery_spec": {
          "format": "ndi",
          "resolution": "1920x1080",
          "frame_rate": 59.94
        },
        "evidential_position": "TERTIARY"
      },
      {
        "asset_id": "lt-council-vote",
        "asset_type": "LOWER_THIRD",
        "status": "READY",
        "evidential_position": "TERTIARY"
      },
      {
        "asset_id": "map-new-rail-lines",
        "asset_type": "MAP",
        "status": "READY",
        "delivery_spec": {
          "format": "html5",
          "resolution": "1920x1080"
        },
        "evidential_position": "TERTIARY"
      },
      {
        "asset_id": "ai-summary-004",
        "asset_type": "SUMMARY",
        "status": "READY",
        "provenance": {
          "author": "MODEL",
          "model": "claude-sonnet-4",
          "model_version": "20250514",
          "confidence": 0.95,
          "generated_at": "2026-05-12T10:12:00Z",
          "input_sources": [
            "src-nyc-council-clerk",
            "src-mta-press"
          ],
          "prompt_hash": "sha256:f6a7b8c9...",
          "review": {
            "state": "CONFIRMED"
          }
        }
      },
      {
        "asset_id": "ai-social-post-001",
        "asset_type": "SOCIAL_POST",
        "status": "IN_PRODUCTION",
        "provenance": {
          "author": "MODEL",
          "model": "claude-sonnet-4",
          "model_version": "20250514",
          "confidence": 0.88,
          "generated_at": "2026-05-12T10:14:00Z",
          "input_sources": [
            "src-nyc-council-clerk"
          ],
          "prompt_hash": "sha256:a7b8c9d0...",
          "review": {
            "state": "PENDING"
          }
        }
      }
    ],
    "skills_config": {
      "skills_spec_version": "2.0.0",
      "skill_executor_id": "executor-nbcu-nyc-01",
      "scope_context": "WNBC Local News",
      "active_skills": [
        {
          "skill_id": "nbcu/editorial-standards",
          "skill_version": "0.1.0",
          "skill_type": "NEWSROOM",
          "disclosure_level": "L2",
          "migration_policy": "GATED",
          "skill_priority": "CRITICAL"
        },
        {
          "skill_id": "nbcu/social-poster",
          "skill_version": "0.1.0",
          "skill_type": "NEWSROOM",
          "disclosure_level": "L2",
          "migration_policy": "GATED",
          "skill_priority": "NORMAL"
        }
      ],
      "newsroom": "NBCU"
    },
    "updated_at": "2026-05-12T11:00:00Z",
    "sequence_number": 8,
    "content_refs": [
      {
        "mime_type": "text/plain",
        "placement": "sources",
        "provider": "NBCU",
        "source_id": "src-mta-presser",
        "uri": "http://localhost:5050/api/content/transit-expansion-2026-0512"
      }
    ],
    "editorial_source": [
      {
        "source_id": "src-nyc-council-clerk",
        "source_type": "GOVERNMENT",
        "provider": "NYC City Council Clerk",
        "credibility": "ENDORSED",
        "received_at": "2026-05-12T10:05:00Z",
        "content_hash": "sha256:e5f6a7b8..."
      },
      {
        "source_id": "src-mta-press",
        "source_type": "PRESS_RELEASE",
        "provider": "Metropolitan Transportation Authority",
        "credibility": "ENDORSED",
        "received_at": "2026-05-12T10:10:00Z"
      },
      {
        "source_id": "src-wnbc-crew-03",
        "source_type": "FIELD_CREW",
        "provider": "WNBC City Hall Bureau",
        "credibility": "TRUSTED",
        "received_at": "2026-05-12T10:00:00Z"
      }
    ],
    "newsroom_id": "nbcu-news"
  },
  "originating_system": {
    "system_id": "ncs-nbcu-nyc-01",
    "system_type": "ncs",
    "system_name": "iNEWS NYC",
    "vendor": "Avid",
    "version": "7.0.1"
  }
}
