{
  "som_version": "0.3.2",
  "message_id": "019536a2-7c3f-7d8e-a1b2-000000000002",
  "correlation_id": "019536a0-2222-7000-8000-000000000002",
  "message_type": "story.context",
  "timestamp": "2026-06-15T21:30:00.000000Z",
  "topic": "som.story.context",
  "payload": {
    "story_id": "election-special-2026-0615",
    "slug": "MIDTERM-RESULTS-VA-GOV",
    "headline": "Virginia Governor Race Too Close to Call as Polls Close",
    "story_type": "ACTIVE",
    "lifecycle": {
      "phase": "DEVELOPING",
      "phase_entered_at": "2026-06-15T20:00:00Z",
      "phase_owner": {
        "user_id": "editor-tchen",
        "display_name": "Tom Chen",
        "role": "assignment_editor"
      }
    },
    "priority": {
      "level": "HIGH",
      "reason": "Election night priority coverage"
    },
    "premise": {
      "expected_outcome": "competitive_race",
      "confidence": "HIGH",
      "premise_changed": false
    },
    "story_meaning": {
      "who": "Virginia voters, the two gubernatorial candidates, AP Elections, the NBCU Decision Desk, and NBC and MSNBC election-night editorial leadership.",
      "what": "The Virginia gubernatorial race remains too close to call as polls close, with 62% of precincts reporting and a margin under one percentage point.",
      "when": "Story published 21:30 ET on 15 June 2026, with the DEVELOPING phase entered at 20:00 ET when polls began closing.",
      "where": "Commonwealth of Virginia, with focus on outstanding counties Fairfax and Virginia Beach; coverage from NBC and MSNBC election-night control rooms.",
      "why": "A close race coupled with embargoed exit-poll data and an active no-projection editorial hold places the desk under HIGH compliance scrutiny.",
      "how": "Real-time results aggregated from AP Elections, the NBCU Decision Desk, and the Virginia Secretary of State, governed by the gate-projection-001 editorial hold.",
      "summary": "The Virginia gubernatorial race is too close to call as polls close, with 62% of precincts in and the margin under one percentage point. NBC News is running the story under HIGH compliance \u2014 AP has not called the race, exit-poll data was embargoed until 19:01 ET, and an editorial hold blocks projection graphics until the Decision Desk authorises a call.",
      "confidence": 0.8,
      "provenance_refs": [
        "src-ap-election-feed",
        "src-nbcu-decision-desk",
        "src-va-sos"
      ]
    },
    "compliance": [
      {
        "flag_id": "cf-election-001",
        "type": "ELECTION_COVERAGE",
        "severity": "HIGH",
        "detail": "AP has NOT called race. Do not project winners.",
        "jurisdiction": "US",
        "regulation_ref": "NBCU Election Desk Policy 2026",
        "raised_by": "election-desk",
        "raised_at": "2026-06-15T20:00:00Z",
        "status": "ACTIVE"
      },
      {
        "flag_id": "cf-election-002",
        "type": "EXIT_POLL_EMBARGO",
        "severity": "CRITICAL",
        "detail": "Exit poll data embargoed until polls close in all VA precincts (7:00 PM ET)",
        "jurisdiction": "US",
        "raised_by": "compliance-engine-01",
        "raised_at": "2026-06-15T18:00:00Z",
        "status": "RESOLVED"
      }
    ],
    "editorial_gates": [
      {
        "gate_id": "gate-projection-001",
        "gate_type": "EDITORIAL_HOLD",
        "status": "PENDING",
        "required_by_skill": "nbcu/editorial-standards",
        "gate_rule_id": "nbcu-election-no-project",
        "resolution_event_type": "manual_override",
        "assigned_to": "election-desk",
        "blocks": [
          "gfx-winner-banner",
          "lt-winner-projection"
        ]
      }
    ],
    "assets": [
      {
        "asset_id": "gfx-va-results-board",
        "asset_type": "x-graphics_pack",
        "status": "READY",
        "standards_clearance": {
          "status": "CLEARED",
          "last_reviewed": "2026-06-15T19:00:00Z"
        },
        "delivery_spec": {
          "format": "ndi",
          "resolution": "1920x1080",
          "frame_rate": 59.94
        },
        "evidential_position": "TERTIARY"
      },
      {
        "asset_id": "gfx-winner-banner",
        "asset_type": "x-banner",
        "status": "PREPARED",
        "standards_clearance": {
          "status": "BLOCKED",
          "blocked_by": [
            "gate-projection-001"
          ]
        },
        "evidential_position": "TERTIARY"
      },
      {
        "asset_id": "lt-winner-projection",
        "asset_type": "LOWER_THIRD",
        "status": "PREPARED",
        "standards_clearance": {
          "status": "BLOCKED",
          "blocked_by": [
            "gate-projection-001"
          ]
        },
        "evidential_position": "TERTIARY"
      },
      {
        "asset_id": "map-va-county-results",
        "asset_type": "MAP",
        "status": "READY",
        "delivery_spec": {
          "format": "html5",
          "resolution": "1920x1080"
        },
        "evidential_position": "TERTIARY"
      }
    ],
    "ai_enrichments": [
      {
        "enrichment_id": "ai-county-analysis-001",
        "model": "claude-sonnet-4-20250514",
        "enrichment_type": "ANALYSIS",
        "confidence": 0.88,
        "content": "With 62% of precincts reporting, the race remains within 0.8 percentage points. Key outstanding counties include Fairfax (23% reported) and Virginia Beach (41% reported), both historically decisive.",
        "provenance": {
          "input_sources": [
            "src-ap-election-feed",
            "src-va-sos"
          ],
          "prompt_hash": "sha256:c3d4e5f6...",
          "guardrails_applied": [
            "no_projection",
            "factual_grounding",
            "election_neutrality"
          ]
        },
        "human_reviewed": false,
        "generated_at": "2026-06-15T21:29:30Z"
      }
    ],
    "skills_config": {
      "skills_spec_version": "2.0.0",
      "skill_executor_id": "executor-nbcu-dc-01",
      "scope_context": "NBC Election Night Special",
      "active_skills": [
        {
          "skill_id": "nbcu/editorial-standards",
          "skill_version": "0.1.0",
          "skill_type": "NEWSROOM",
          "disclosure_level": "L2",
          "migration_policy": "GATED",
          "skill_priority": "CRITICAL"
        },
        {
          "skill_id": "nbcu/social-poster",
          "skill_version": "0.1.0",
          "skill_type": "NEWSROOM",
          "disclosure_level": "L2",
          "migration_policy": "GATED",
          "skill_priority": "NORMAL"
        }
      ],
      "newsroom": "NBCU"
    },
    "updated_at": "2026-06-15T21:30:00Z",
    "sequence_number": 134,
    "content_refs": [
      {
        "mime_type": "text/plain",
        "placement": "sources",
        "provider": "NBCU",
        "source_id": "src-ap-election-feed",
        "uri": "http://localhost:5050/api/content/election-special-2026-0615"
      }
    ],
    "editorial_source": [
      {
        "source_id": "src-ap-election-feed",
        "source_type": "WIRE",
        "provider": "AP Elections",
        "credibility": "VERIFIED",
        "received_at": "2026-06-15T21:28:00Z"
      },
      {
        "source_id": "src-nbcu-decision-desk",
        "source_type": "INTERNAL",
        "provider": "NBCU Decision Desk",
        "credibility": "TRUSTED",
        "received_at": "2026-06-15T21:29:00Z"
      },
      {
        "source_id": "src-va-sos",
        "source_type": "GOVERNMENT",
        "provider": "Virginia Secretary of State",
        "credibility": "ENDORSED",
        "received_at": "2026-06-15T21:25:00Z",
        "content_hash": "sha256:b2c3d4e5f6a7..."
      }
    ],
    "newsroom_id": "nbcu-news"
  },
  "originating_system": {
    "system_id": "ncs-nbcu-dc-01",
    "system_type": "ncs",
    "system_name": "iNEWS Washington",
    "vendor": "Avid",
    "version": "7.0.1"
  }
}